{
  "$schema": "https://json-schema.org/draft/2020-12/schema",
  "$id": "https://raw.githubusercontent.com/TheLithiumForge/open-forge/main/schemas/v1/open-forge.lock.schema.json",
  "title": "Open Forge workspace lock",
  "description": "Generated by Open Forge. Records verified ownership and route-sharing choices. Sharing choices grant no deletion authority. An absent lock is known empty. Commands refuse effects that require trustworthy facts when an existing lock is invalid or unreadable.",
  "type": "object",
  "additionalProperties": true,
  "properties": {
    "$schema": {
      "type": "string",
      "format": "uri"
    },
    "schemaVersion": {
      "type": "integer",
      "description": "The shape this file was written for. A version the CLI does not recognise is read for the keys it understands and reported, never refused.",
      "minimum": 1
    },
    "framework": {
      "$ref": "#/$defs/frameworkOwnership"
    },
    "extensions": {
      "type": "array",
      "description": "One entry per installed Extension. A path owned by several Extensions is not recorded as shared; that is derived by intersecting these lists.",
      "items": { "$ref": "#/$defs/extensionOwnership" }
    },
    "libraries": {
      "type": "array",
      "description": "One entry per attached Library.",
      "items": { "$ref": "#/$defs/libraryOwnership" }
    }
  },
  "$defs": {
    "ownedPaths": {
      "type": "array",
      "description": "Workspace-relative paths the CLI created in full. These may be deleted when nothing else owns them.",
      "items": { "type": "string", "minLength": 1 },
      "uniqueItems": true
    },
    "ownedRegions": {
      "type": "array",
      "description": "Named regions the CLI generated inside files somebody else authored. These may be rewritten; the file holding them is never deleted.",
      "items": {
        "type": "object",
        "additionalProperties": true,
        "required": ["path", "region"],
        "properties": {
          "path": { "type": "string", "minLength": 1 },
          "region": {
            "type": "string",
            "minLength": 1,
            "description": "The region marker name, such as \"entries\"."
          }
        }
      }
    },
    "frameworkOwnership": {
      "type": "object",
      "additionalProperties": true,
      "required": ["source"],
      "properties": {
        "source": {
          "type": "object",
          "additionalProperties": true,
          "required": ["id"],
          "properties": {
            "id": { "type": "string", "minLength": 1 },
            "version": {
              "type": ["string", "null"],
              "description": "The release that wrote these entries. Compared by version alone; no payload hash is recorded, because the lock records ownership rather than integrity."
            }
          }
        },
        "paths": { "$ref": "#/$defs/ownedPaths" },
        "regions": { "$ref": "#/$defs/ownedRegions" },
        "gitIgnoredRoutes": {
          "type": "array",
          "description": "Private route directories with one shared direct entrypoint. Install registers these before applying Gitignore. Generated shared navigation omits their private contents. These records grant no ownership or deletion authority. Absent means no sharing policy.",
          "uniqueItems": true,
          "items": {
            "type": "object",
            "additionalProperties": true,
            "required": ["directory", "entrypoint"],
            "properties": {
              "directory": { "type": "string", "minLength": 1 },
              "entrypoint": { "type": "string", "minLength": 1 }
            }
          }
        }
      }
    },
    "extensionOwnership": {
      "type": "object",
      "additionalProperties": true,
      "required": ["id"],
      "properties": {
        "id": { "type": "string", "minLength": 1 },
        "version": { "type": ["string", "null"] },
        "source": {
          "type": ["string", "null"],
          "description": "Where the Extension was installed from, such as \"bundled\" or an explicit source path."
        },
        "dependencies": {
          "type": "array",
          "items": { "type": "string", "minLength": 1 },
          "uniqueItems": true
        },
        "paths": { "$ref": "#/$defs/ownedPaths" },
        "regions": { "$ref": "#/$defs/ownedRegions" }
      }
    },
    "libraryOwnership": {
      "type": "object",
      "additionalProperties": true,
      "required": ["id", "sourceRoot", "destinationRoot"],
      "properties": {
        "id": { "type": "string", "minLength": 1 },
        "sourceRoot": { "type": "string", "minLength": 1 },
        "destinationRoot": { "type": "string", "minLength": 1 },
        "paths": {
          "$ref": "#/$defs/ownedPaths",
          "description": "Source-relative eligible paths projected as leaf links beneath destinationRoot. Their workspace destinations combine destinationRoot with each path (or use the path directly when destinationRoot is .). Directories are not recorded, because detach does not remove them."
        }
      }
    }
  },
  "examples": [
    {
      "schemaVersion": 1,
      "framework": {
        "source": { "id": "open-forge", "version": "0.1.0" },
        "paths": [".agents/loader.md"],
        "regions": [
          { "path": ".agents/directives/_directives.md", "region": "entries" },
          { "path": "AGENTS.md", "region": "open-forge" }
        ]
      },
      "extensions": [
        {
          "id": "planning",
          "version": "0.1.0",
          "source": "bundled",
          "dependencies": ["development"],
          "paths": [".agents/templates/planning/plan.md"],
          "regions": []
        }
      ],
      "libraries": [
        {
          "id": "shared",
          "sourceRoot": "libs/shared",
          "destinationRoot": ".agents",
          "paths": ["patterns/api.md"]
        }
      ]
    }
  ]
}
